cluster_id,item_id,x,y,item_name
26,62473,-2.5012931813434007,3.4523177117654216,brian l duffy attorney
26,62482,1.3336871361587916,2.5351694957160267,christopher neumann attorney
26,91546,-2.9432369546392043,2.8057743223650937,timothy j fete attorney
26,110334,-2.1676669094401033,3.0964067678298126,michael l platt attorney
26,176189,-2.396183527305382,-2.9420723128614306,park avenue west law office
26,176202,-2.3994141724788998,-2.8977389480734024,archuleta law office
26,176209,-2.6405020057072504,0.2617662551653418,craig l truman pc
26,176211,-2.2704931251310856,-2.6124119634830447,larry carroll law office
26,176563,-2.2626737845411427,-2.8734987483529086,lefferdink law office llc
26,187824,-1.1409668984887278,2.302770859793038,steven m kaufmann attorney
26,199827,1.43036530549973,2.072697761826457,jacobs chase frick kleinkopf
26,209582,-1.6569842477961336,0.4314093626883722,duane j electric
26,327660,-1.932722937993355,0.10952682919433243,roger t castle p c
26,335000,1.4640064626203888,-1.1417083833271449,law sales
26,384686,-1.4921048367386838,1.3363169268144754,gary c johnson
26,391185,3.3891284637693913,-3.1187073645488845,arapahoe county government arapahoe county district court
26,392761,-2.2482987625504514,-2.6006691988609267,kerry hada law offices
26,392765,-2.1711181076179944,-2.7899472382311594,radakovich law office inc
26,393557,-2.862503084432912,1.5440555457827585,henry l smith jr attorney
26,393856,1.4948143949752877,-2.1786572752164477,kulasza law partners pc
26,394205,-2.7815070620800757,0.5050733646523091,david l kolko pc
26,394262,-2.7685815230769593,0.4236234411794229,richard l dally pc
26,429869,-3.4855426853096003,1.5315760006117751,morgan county district attorney
26,432805,-0.4821698433531094,0.9104418218002822,james e law
26,446826,-0.09033999440138024,5.2282798809256015,jose p martinez
26,448553,-2.159148637636948,3.8188934360194438,morton l coggan attorney
26,532581,-4.624895104019727,2.0743755370681742,eagle county attorney
26,576081,-1.030140480726375,3.1995422686174617,howard r hertzberg attorney
26,582342,5.0360200355128395,-2.0372085598290006,mc elroy deutsch mulvaney
26,642697,-0.8054377717625608,1.851794674151865,cory b tenbrink attorney
26,642698,1.7261618666041962,4.006507098169212,ronald yaklich attorney
26,642885,-0.7295575478690733,1.9192081377013648,edwin h crabtree attorney
26,740833,-0.9983224667747708,3.390025304844972,richard c lonnquist attorney
26,750920,-1.1005850779749191,-1.3778029738138853,lowe marie h law office
26,750922,-0.6485805040391546,-1.259028764450132,law office of marie h. lowe
26,768535,-0.39031708191440784,-2.75237687351475,msi contracting
26,788348,-0.9239674031373829,-2.71646221483088,garfield & hecht pc
26,788481,2.080552697489383,-0.9505592260555816,aspen municipal court
26,789119,2.110481278902274,-0.9732683523997958,judicial dept-county court
26,790611,-2.1358318792843907,-0.2563700160556428,mark s rubinstein pc
26,790612,-1.2589699435857258,1.7201828961903378,mark s rubenstein attorney
26,790650,-0.1173549429714549,5.089211030683533,chad j barsness attorney
26,810483,-1.5289195132872873,-2.5498201519419643,legal defense corp
26,852155,-4.644883474321598,2.0771960790822153,clear creek county attorney
26,857188,-2.845706154940417,1.3582335270156876,catherine l thompson
26,886781,0.06119349163243105,5.162553052871718,andrew r johnson attorney
26,886782,0.07338406892774724,5.156601238280826,peter m johnson attorney
26,894777,-4.629076578977629,2.082850817321552,delta county attorney
26,894984,-1.1912683546647929,-0.13259496199184184,mc carthy shultz vaughn
26,898626,-1.980730950202488,-1.1908191530864205,timothy h berry pc
26,967923,-0.3402063062368145,-1.2784782868418865,law office of james a lionberger
26,968966,-0.7256167762008019,2.89802230042634,jeffrey d larson attorney
26,969899,-0.0701026534068877,0.22209740900740346,"law offices of sylvia r. lovisone, llc"
26,969900,-0.13454562189960026,0.5421170112629755,sylvia r lovisone attorney
26,970651,0.9596073023976136,4.31849784105879,peter rogers lawyer
26,970655,0.5629545620928093,4.9487458759629925,peter rogers attorney
26,970681,5.164192309349373,0.6606477016850875,clinton k nash attorney
26,972171,1.277485932059001,-3.1679418614950183,kapsak law firm llc
26,972196,-0.1490283587283752,5.013201493864375,dwight k harding attorney
26,972208,-2.9211868429755654,-0.2745147217467814,miller & cohen pc
26,973357,5.603199608245196,-0.4927076269743321,scott w dunn attorney
26,973358,5.619152533274561,-0.3635798261101489,lee r elsberg attorney
26,973359,3.885796705896904,-2.234933597032847,flanders elsberg & dunn llc
26,973360,5.623264762735278,-0.4769733463997886,john c flanders attorney
26,973788,-0.3533161094422502,1.0650481877222748,mark b clevenger
26,974662,-0.7368560035032776,4.968824605856062,daniel c doherty pc
26,975068,2.118231333774353,-0.9801580243460332,mead municipal court
26,975099,-0.7934773935531872,-2.6192225136496257,hmp medical review service inc
26,975294,-1.9662577072456944,-1.2744735618276255,theodore d schey iii
26,975295,-2.4150752393576598,-3.3064146859832277,schey piller alspaugh & wong pc
26,975297,-2.5598489004041456,-3.3582411971215684,schey piller alspaugh & wong
26,975707,3.6821656483176506,0.09451521207990403,grant grant & goiran llp
26,979995,-4.211416401348291,-2.167528123920578,warren carlson & moore llp
26,979996,-0.4846394453232517,2.9217662917522924,richard n carlson attorney
26,981102,0.2448247051601879,0.15115667273732256,"liz osborn law, llc"
26,981164,-2.155952894979223,1.8681863817604685,jeffery w mangus attorney
26,981759,0.4469610184246277,-1.1107741679071197,stoneman legal
26,982164,1.9554498164544147,3.9769341180012,nick wimmershoff attorney
26,983616,5.946249108886813,0.0426725400385006,harry j holmes
26,983656,1.0359408951707698,2.524155956958534,jennifer m spitz attorney
26,983741,1.873174169433816,0.4589891420370856,brad a hall attorney
26,983742,-1.8072138367161272,2.3376826264820862,john w gaddis attorney
26,983743,-3.799129968564426,-1.9098724354214578,lyons gaddis kahn & hall
26,984462,-1.172624837381767,-3.3757747785835304,"bernard, lyons, gaddis & kahn, a professional corporation"
26,988607,2.2899269919830427,2.3457874571181168,susan k bryant attorney
26,988610,3.6914955812790335,1.4228996425327098,mark herber
26,988611,3.859312401739608,-2.1598125782421764,longmont divorce lawyer
26,988804,4.4160315435449125,0.3729748262438012,charles saxton attorneys at law
26,989643,-1.6097481899534365,3.5281342783653216,peter b scott attorney
26,989645,1.49345683565501,-2.599338237404,keeth-scott law group p.c
26,993932,0.6141130534033405,-1.6110021928865483,affordable bankruptcy attorney of boulder company
26,1001982,-4.657968907504221,2.0578188309818626,grand county district attorney
26,1062966,-3.0975594961735244,2.1185843152691053,gary appel attorney
26,1063012,1.1417157740062471,-2.897154605074007,william muhr law firm
26,1100763,-3.7084999944614263,1.2986584601723856,"jordan reed advertising, inc."
26,1129286,-2.659773473237076,3.500672627983858,penelope m griffin attorney
26,1134621,-0.6365431259809357,-3.1863940731108062,prince international invstmnt
26,1175044,1.3690230293509624,1.6900305540390907,richard nagel attorney
26,1190026,-0.4951843055323859,2.497341544566704,jeffrey c shaw
26,1245168,-1.6140630125454996,-3.22512380472754,cross johnson & associates
26,1294142,0.5341424785791632,3.588454133531016,georgiana scott attorney
26,1294144,-1.2541444113820976,3.186991752078223,georgiana r scott attorney
26,1294207,5.895280976063707,-0.0024710187718377692,tracy p stoneman attorney
26,1294241,-0.9533368002843158,-1.1318197907070089,"mernitz, david, law offices of"
26,1305767,-0.7566633875598213,2.7662003263235264,dwight r landes attorney
26,1305772,1.817793062121262,0.5689677738716528,leslie a eaton attorney
26,1305773,-1.8381861309801744,2.722093693421272,martha s nachman attorney
26,1305785,-0.3791562917060509,2.659426841045568,beverly j quail attorney
26,1305786,-0.9357593240544062,2.8621615324992584,michael w clowdus attorney
26,1349015,-1.3484737738508243,-2.6517019021504584,sports lawyers association
26,1397339,1.7239739645348051,0.5778540753746604,james a black attorney
26,1401266,1.72945676925188,1.995603609705592,robert e krute attorney
26,1418595,1.7909903990133706,0.6154603066040152,craig a christensen attorney
26,1418596,-1.938920042111293,1.6774332089521464,harrie f lewis attorney
26,1418597,-1.783293515320161,2.1949967903898955,harold g morris attorney
26,1444972,-0.3951583471238085,-1.2955517048670702,"the law office of dennis love, llc"
26,1456289,5.452934535666949,-0.8674201257938942,john r olsen attorney
26,1496861,-2.5698405225333243,-1.2681595483893386,patton law office
26,1496867,0.004437527959275888,5.193566208626799,gregory v johnson attorney
26,1496868,-0.7773114415201228,1.4525410601087416,james k lewis attorney
26,1496872,0.13374595234857892,5.1395698233108025,carl a forest attorney
26,1525491,2.530597366266481,2.9921180541609598,richard hopper attorney
26,1526560,-1.8095617314912973,-0.04809949914806234,james d evans pc
26,1526561,-1.4651004187379495,-0.09633214182715026,james d evans law office
26,1610438,-1.950910137014841,-0.8657694147616126,richard huttner pc
26,1610440,-1.5869261059124358,1.7401486577742609,richard b huttner attorney
26,1642847,-2.7049157058996287,-1.0064665815393756,springman & braden pc
26,1724453,-0.7604869535771582,2.27408197090056,patrick c hyde attorney
26,1768729,2.527589539222498,2.414897825853072,david f steinhoff attorney
26,1786633,-4.664919683156184,-1.3819240322020128,altman keilbach lytle
26,1786634,-2.2235594446803044,-1.301947598547719,altman keilbach lytle parlapiano and ware pc
26,1887726,3.3447712890961827,-1.2829574635344243,carney law office
26,1911808,3.797876031617214,0.0860773580275982,creamer law firm pc
26,1990920,-4.387672391359222,-0.4004227493947763,rubin & raine
26,2014457,5.184089843379331,0.6273094605068869,ralph e miller attorney
26,2034533,1.9874507783109645,0.5054954032874447,peter a jaffe
26,2046387,-4.666618015343847,2.064849457725095,rio blanco county district attorney
26,2047752,-4.6758954969452375,2.0553293453818293,montrose county attorney
26,2056089,-4.285929753730429,-2.5952342050065926,hinshaw & culvertson llp
26,2087466,1.943306395478874,0.5160558876601328,scott a porter
26,2111490,-0.8415213118376703,2.2741339120233146,rebecca c alexander attorney
26,2141701,-0.08526385625187863,5.2200141404749285,john h case co
26,2157744,-3.115028010611401,-2.406133668518806,mitchem & flanigan
26,2247501,-2.0075459173613317,-2.314429683091149,law offices david silverman
26,2254183,-0.4151267707205392,4.702033040593503,atkins law offices of chad a
26,2276112,-1.887670235353467,2.9044814268769428,anthony v mello attorney
26,2349944,1.4805095045734216,2.5053685126297447,michael j wozniak attorney
26,2349945,1.473823533469428,2.3965676053834,katina c banks attorney
26,2430315,1.8468252495424824,0.5557736011073616,sean a kendall attorney
26,2450232,-4.007851826387543,-1.7157770694558578,riggs abney neal turpen orbison & lewis inc
26,2469559,-0.08899860025258913,5.248234223996227,richard w bryans
26,2491610,5.770292117152112,-1.2924315298857862,jennifer m causing attorney
26,2491612,5.149805976120313,0.6459202456445781,david t hailey attorney
26,2503693,2.102838075076926,-0.9717670001205791,fountain municipal court
26,2507335,-1.8917428244290069,2.9023621046422075,glenn h schoolabs attorney
26,2583808,2.9735386199411145,0.21780500550102214,westminster law library
26,2585159,-2.3100398437656815,-2.616863414288421,thorburn law office
26,2664074,-4.30234360735476,-1.8310593754017976,"davis graham & stubbs, llp"
26,2664075,-4.26474698111334,-1.8714642687445893,"davis, graham & stubbs llp"
26,2664078,1.851959685646256,0.5687429500811463,william a bianco attorney
26,2688395,-0.07767815916180566,5.1202087861160335,thomas c waddle attorney
26,2702484,-2.516815985354123,1.9978473560736656,charles w bess attorney
26,2702486,-0.7452943674285561,2.828518181615141,paul t ruttum attorney
26,2706273,1.8745743821900909,3.956165646478045,joe fennessy attorney
26,2706274,-2.6105710985782773,-0.2845010330322894,joe fennessy pc
26,2706275,1.323202292224883,-0.4883970678033506,fennessy joe attorney at law
26,2714378,-0.4570272389683067,-2.8081712155385232,zuspann & zuspann
26,2811485,1.992012741336272,0.5230688439126332,donald a degnan
26,2811486,1.0317914946724518,2.264420467446246,geoff barry attorney
26,2811487,1.7758638423622977,4.168640862104882,donald degnan attorney
26,2811488,-2.777746619118448,3.611644624722045,scott s havlick attorney
26,2811490,-3.201284217994185,3.570049467597697,ester m maillaro attorney
26,2811491,-3.1102129962353198,3.549814678101181,timothy m rastello attorney
26,2811502,0.3432562473099249,3.0326013511875423,mark hamilton attorney
26,2811508,-4.159408178188321,-2.362705205001584,holland & hart llp
26,2811509,-3.133529607176892,3.6439835504045206,alison m suthers attorney
26,2811510,1.7719117392973258,4.211282130276321,douglas abbott attorney
26,2811511,-2.2139987964943235,1.822690282210038,ivan p koves attorney
26,2811512,-2.0783554570113782,1.734371391232205,james e hartley attorney
26,2811513,-2.7606898571788645,3.665637581513723,kevin s crandell attorney
26,2811514,-2.703202820038712,3.6662911777200184,kevin j bridston attorney
26,2825066,5.162581094770085,-0.7096161278629916,evans court clerk
26,2876890,-2.5074925069989114,3.5247682387392314,kevin l ehlers attorney
26,2876891,0.9141446428955642,-0.9359451579938308,"kevin ehlers law, pc"
26,2901530,5.33976593701925,-0.9273645524313406,randy l williams attorney
26,2902807,-2.9825755143779134,-0.6570242952877005,"berenbaum, weinshienk, & eason pc"
26,2902808,-3.4076373910491418,-0.6775811595313609,berenbaum weinshienk pc
26,2904795,0.4808225539939097,1.8024343747914944,james e gigax attorney
26,2904886,-4.665498140391624,2.161761176362309,loveland city attorney
26,3000840,3.5489576670936853,1.5016443957044612,mark clinard
26,3004696,2.0435977548097406,-3.953262319538681,attorneys service
26,3004700,1.9762617619424887,-3.776455796298192,video conference center of denver
26,3005089,-0.1000731580619849,-1.5298286900419291,bradford publishing
26,3006549,2.0663763725791697,-0.9726492684523842,denver civil court div
26,3017973,1.3362959671981982,-1.1470137482402558,pro bono project
26,3018122,2.1108577432761937,-1.0170644423285884,monument municipal court
26,3024800,-4.253341323321132,-2.1254844633871968,"rothgerber, johnson & lyons llp"
26,3024801,-1.9173173108069956,2.8209002527621667,bruce n warren attorney
26,3024802,-1.5995238319707048,2.993259056234782,brent r cohen attorney
26,3024803,-0.38912850184825104,2.6949775762474286,joy t woller attorney
26,3024806,1.4292963092805884,2.4657433879478905,michael d nosier attorney
26,3030296,-4.648201410560087,2.1736146629327733,littleton city attorney
26,3035393,-1.2032150731933149,0.010928554081475571,j b katz law office
26,3085687,-1.933131264663724,2.9959331177543747,alan s thompson attorney
26,3163169,-1.6320606582166428,-2.3112945547165555,ab planalp law office llc
26,3204964,-0.2443494314961888,-1.8842420776108688,"wagner law office, pc"
26,3312791,-0.27720173445227125,-2.0714073499189776,stephen berken law offices
26,3320140,3.3429196915095383,-1.4602823840924268,oldaker biden & belair law office
26,3320141,3.3385655129544585,-1.492071554548894,oldaker biden & belair law office
26,3373738,-4.2506996028599975,-0.737589605625076,goff & goff llc
26,3462086,-4.6255079320589845,2.071110349958143,huerfano county dist attorney
26,3474091,-2.4438785376410754,0.5316967190548538,"hall & evans, llc"
26,3474096,2.4178838127091877,1.970978133092362,david r brougham attorney
26,3485065,0.3301136764185397,3.425602928380993,"hoffman, john"
26,3511713,-4.665708259646067,2.0530490188783173,las animas county district attorney
26,3524789,-0.6660896009471052,2.856270379096141,ronald r way attorney
26,3545139,0.8435300805001172,-3.118374330517652,taylor law firm llc
26,3549428,5.297091305255551,-0.4079129828554268,lee a strickler attorney
26,3549429,5.649682387143037,-0.8064388496867906,mark e biddison attorney
26,3549430,4.943078833374594,-0.689560036765005,jessica catlin attorney
26,3549431,5.373190052972611,-0.01514288666021192,lee stricher attorney
26,3563151,1.3039584376547209,-0.9100003273608192,attorney at law llc
26,3565278,-2.6062460773978966,3.084987911019597,cynthia m ciancio attorney
26,3615648,-2.862203050219866,-2.384331943717619,calvert & calvert
26,3634581,-4.823561057732069,0.39361598202105497,glatstein & o'brien
26,3634582,-4.824946186156415,0.368717324113538,glatsein & o'brien
26,3644736,0.007819610235007156,5.208599045422369,peter f michaelson attorney
26,3653493,-0.7875122023680268,-1.1687184223077018,the law offices of randal
26,3680541,1.8090836707849343,4.003523191740356,harold faletti attorney
26,3729792,3.3860504335211554,-1.1032327976586085,posner law
26,3755654,0.14976032371766818,-2.164700468764364,the accident and injury co of grand junction
26,3790515,1.8993973486845737,0.5147620294314285,jeremy a sitcoff attorney
26,3880977,0.9266017855185849,2.0409450903051223,attorney ronald schwartz
26,3880978,1.034442840612996,-2.2350867915967045,ron schwartz law firm
26,3972855,-2.434064784540624,2.238212194020733,edward w pabst attorney
26,3983073,4.683292732847625,-0.3328525523176407,jon lewis kelly attorney
26,3996146,1.0393294897666885,-3.1476623534593133,yates law firm llc
26,4036745,1.9229549559591868,3.922685176031888,stephen berken attorney
26,4040878,-0.7497660430552288,-1.2944117857895745,law office of jeff vail
26,4040879,0.5202483069777439,5.089094265492214,suzanne griffiths attorney
26,4040881,2.3787429728213025,2.937730315367166,russel murray iii attorney
26,4053501,0.9180928413751244,-0.2818927625789366,"malouff, charles j attorney at law pc"
26,4053543,-1.72420926626724,-3.8557724106459697,david s oppenheim & associates
26,4053880,5.260604021464867,-0.5168575101236345,dean a aarestad attorney
26,4053882,4.386297403859858,-1.5096216111691774,aarestad law office p c
26,4055905,-1.821559103265388,1.568542656693695,doris b truhlar attorney
26,4055907,-0.4563322286389368,-2.7602249778597407,truhlar & truhlar
26,4055908,0.4978410476430444,1.0970397186336636,truhlar and truhlar llp
26,4056345,-0.6118862519672602,-0.976291722403332,law offices of cheryl a miller
26,4057568,-2.1792035200302267,3.39812829538136,sean m mc curdy attorney
26,4057627,5.318629736099771,-0.5206806777370611,matthew a holmes attorney
26,4058772,-1.7845102831918642,2.4779783607204866,richard h sugg jr attorney
26,4060849,5.921208611435803,0.03409669797524205,amundson paul t
26,4061358,-1.3661018067657726,-1.756521684979335,o'malley law office pc
26,4061419,-0.9418402988397936,-2.6435545928365194,tobey & toro pc
26,4061425,3.5266638390033345,0.04537788185121775,the bret beattie law firm
26,4061632,0.5377248419405114,1.2189437372262164,cimino & benham
26,4061633,-0.5510577689171877,-1.3549669272717242,law offices of cimino and benham llc
26,4061636,0.5658726912597779,1.1299829437759643,cimino & benham denver bankruptcy
26,4061637,3.418824336285797,-0.36998693072635175,werking law
26,4061897,4.229556094692557,-2.8183713703398285,farrell & seldin
26,4061898,4.23182825066029,-2.816542290000465,farrell & seldin
26,4061922,0.3385022797647201,-3.5554500112652363,johnson law corporation
26,4062145,2.6362483036726245,1.5363110444160903,pc walberg dagner & tucker attorney
26,4062146,2.7880203608109433,1.579852285713799,walberg tucker & holmes
26,4063210,0.17117391043043587,-1.3436572953373611,"calvert, chadwick d law office of llc"
26,4063219,-2.1807947815017847,-0.27643237098423595,j r phillips & associates pc
26,4063220,-2.2680593014173938,-0.4749791181067965,"jr phillips & associates, pc"
26,4063608,1.6056742226899914,-2.9675325715220535,stutheit & gartland p.c attorneys
26,4063609,-2.4056927241806534,-1.1322965774668614,stutheit and gartland pc
26,4064719,1.0982539092833905,-2.952168663992726,the limbaugh law firm
26,4064721,1.4490020946221729,-2.088313167826599,the rufner law firm pc
26,4064722,2.375059158763261,2.2351254945269408,richard k rufner attorney
26,4064724,1.4723704254276675,2.4028698922074074,bruce b mc larty attorney
26,4065951,5.310964070970559,0.4725455413588939,ronald c forman attorney
26,4067508,0.6309641117465653,0.06419673827272326,moss law firm llc
26,4067618,-1.3919939753921646,-1.9736418084883431,barry k arrington law office llc
26,4069144,-0.4661932423830881,0.7970462516348802,kyle d laws
26,4069312,-0.6570686628166983,-1.017648924209199,law offices of matt martin pc
26,4069423,2.0948386313667937,-4.005326983362319,hazlett and bowen
26,4070106,0.080758467392267,3.2893980050425173,wagner hanssen and miller llc
26,4071375,-1.5758080867742108,1.595066500764845,bonnie s shields attorney
26,4072081,-2.167666858460134,0.4478893062087128,barbara cashman llc
26,4073328,3.877672873609588,0.10444179828295794,bradley & associates law firm
26,4075039,5.845776456901182,-1.2551735202757481,douglas j kwitek attorney
26,4075245,-0.8609528387827549,2.482286465537343,daniel r rosen attorney
26,4075340,5.367929660561956,-0.9816659501753618,carol l martin attorney
26,4075724,1.0980562274371437,1.0354463773687963,tuck young attorney
26,4077233,-2.377599601906872,-2.7933335529722734,heuser & heuser law offices
26,4078327,5.618587352378551,-0.9847078791156552,ronald e yaklich attorney
26,4078486,0.8573560125524664,3.5112132503806937,wesley hassler attorney
26,4078489,-0.2788465332036963,-0.10172815364159092,the law firm of john l rice
26,4079284,3.512533668281942,-3.1646003706165686,pueblo attorney
26,4080468,-0.8111500754342038,1.4904549869394403,pearlman david h attorney
26,4081662,5.15698589990337,0.5427572558920937,melissa esquibel attorney
26,4082054,4.080797415675981,1.9560877712245128,bradley bufkin attorney
26,4082055,0.8461888422700646,2.1789145802765804,james r gerler attorney
26,4083838,4.8871312788982175,0.851523980726166,diana cuneo attorney
26,4083839,0.8888669164797858,-1.6372131068012632,the law firm of mickey w smith
26,4083841,0.7459332884211457,-3.1985876425859168,legal edge consulting llc
26,4084287,5.017177648520615,0.8733869341405773,jamie allen attorney
26,4088116,3.78458783567336,-1.8014427478313717,cahn & partners llc
26,4091324,4.557834673496995,-0.7133240890010234,james gillies attorney
26,4092272,-1.4305578459572372,-2.6334315133490085,colorado legal associates inc
26,4092449,0.2255060212135819,-1.3562516685815893,law office of martin e jackson
26,4135206,-1.5090893395606453,-1.3742295679340941,san luis vly imigrant rsrccntr
26,4135365,-2.317169729268732,-0.1608697075623498,"keith d. vance, pc"
26,4135367,-2.4558998045635647,-2.8391697247068817,vance law office
26,4135512,-2.349713864124551,-2.640628425150952,motz law offices
26,4136513,-2.3062996971720904,-2.6750728788412443,garcia law offices
26,4136530,0.7120062712517822,-0.9792349382210186,colorado lawyer-cba journal
26,4179018,-2.9835564386738014,0.7516429451037986,howard gold properties
26,4223060,1.58736664293458,3.9187596381803464,margaret walker attorney
26,4231548,4.924825646708505,-1.3774963198608632,duane woodard attorney
26,4322328,-4.032628920410956,0.8354826651629848,brown schottelkotte & tweedell
26,4362021,-0.4448183179728553,-2.9534163016059285,wink & wink pc
26,4434923,-1.0766792718394336,2.727455183739333,stephen h cook attorney
26,4434926,-2.3064085022017364,-1.170775461321552,steve cook & associates
26,4438486,1.4482965653506594,-2.321274471121481,the firm mccallum law
26,4464603,-1.0690691006395847,2.5513770904920707,michael d hockersmith attorney
26,4464604,-0.07975265288395071,1.701572467611702,mark t howe attorney
26,4527560,-0.40459704856659057,-2.1507599945171263,tami graham mediation training facilitation and coaching services
26,4614311,-1.9999793842470104,-0.21279490027097214,ttl s attys
26,4631029,-0.06292594321389748,5.198904998027107,"attorney general, colorado"
26,4685845,2.1106296480439326,-0.9619106240602884,lafayette municipal court clrk
26,4693071,-1.4306264018341888,-1.8973260589910939,will smith law office
26,4699214,-1.1901815344273643,-1.3604193100358442,law office kirk d william
26,4764155,1.4556070888547132,-2.9932603822573456,callahan law firm
26,4766012,-1.5688226183423617,-3.731440062618931,"cooper, tanis, fuller & cohen pc"
26,4766013,-1.4984799053945643,-3.759784109592958,anna r armas attorney
26,4766014,2.0922741396421025,3.453606443861577,michael i cohen attorney
26,4766016,-3.744477136302916,-1.6613045148156522,cooper tanis fuller & cohen
26,4766489,3.261641681752049,-1.2761981024812241,samira recob law office
26,4767869,-2.2751703795890514,-0.20737439120192636,lee d warkentine atty pc
26,4768047,-2.743556062498724,-1.0395518678447646,dena nielson silliman pc
26,4768048,-2.8295320676650246,1.9766902661591887,dena s nielson attorney
26,4768075,-0.803024937622014,-0.7394118559409313,mann stuart d a law offic
26,4768447,-3.998182682975708,-1.5276057224551682,marion mcbain
26,4769111,5.077499970445247,-0.9234904128939148,linda l bishop
26,4769234,0.882841531178935,-3.2013053449534263,"tenge law firm, llc"
26,4769359,-2.6739175347168107,2.0489673177982497,katherine mackey attorney
26,4769360,0.1007267369919126,0.7439048778657918,ruegsegger simons smith & stern llc
26,4769585,-1.0476787822618747,1.3932905260951187,s s law group denver
26,4769913,5.347970335894731,-1.2031780474244247,jacqueline st joan attorney
26,4769937,5.30829153100654,-0.26459811506588704,mark a weseman attorney
26,4771493,-1.3588744706708469,-1.630908948074414,culter law office pc
26,4771878,-2.4657586308514423,3.397363954082212,lois t gray attorney
26,4774030,3.5158336366045693,0.1213822562006953,maximon law firm llc
26,4776210,1.1052185375956374,-2.8260448594919385,bruce a danford law firm
26,4776837,-0.4664710493840396,-2.76771862494818,connolly rosania & lofstedt
26,4777845,-0.5754427813167243,-0.3636854528317767,the law office of john l wright p c
