cluster_id,item_id,x,y,item_name
26,6817085,-1.6500535206260312,2.6274600776061177,jonathan b boonin attorney
26,6817086,-1.410719754892261,2.404550035651676,justin c konrad attorney
26,6818180,-1.0028946810063109,1.2826709900916595,"stuber, paul drew"
26,6818181,1.268153133442799,-1.2094165682221214,paul drew stuber attorney at law
26,6819068,-0.8895503861020818,-2.496321016828288,mark a leachman pc
26,6819093,-1.1834370065245978,2.640526972453661,glen f gordon attorney
26,6819110,2.4457210669019256,-0.4284695700895136,sheriff department-personnel
26,6819126,4.569316041833419,-0.7649995015948986,james bonn attorney
26,6819341,0.7476035518112928,-1.2391898469186948,law firm of jessica h miller llc
26,6819342,0.7598548541009675,-1.2258815369537814,jessica h miller law firm
26,6819530,1.2007002254577333,-0.9650708077472441,"doan, rachael attorney at law llc"
26,6819537,-2.6907714936914235,-0.7305574479755536,schlender & stone pc
26,6820116,-0.9755475776117206,2.4545550192053893,michael c morphew attorney
26,6820398,-0.14306253621942833,-1.8632707769883237,law offices of randall m weiner p.c
26,6820454,0.23932496044990445,0.4267222578610633,buchholz mc dowell & norman
26,6820455,1.0276604415639066,0.6472791328162927,roger a buchholz attorney
26,6820508,-2.6657859451797625,2.1322739631887133,patricia s bellac
26,6820509,0.8283274504946238,-2.8559574921572386,patricia s bellac law firm llc
26,6820510,1.8061204120620225,4.135848715082292,patricia bellac attorney
26,6820888,1.4399694151562692,-2.5801792060077147,mertes law firm
26,6820889,-1.8478898206093868,0.3721944703160452,mertes lawrence s
26,6820897,-0.8319969448501884,2.1821417786307604,david g eisenstein attorney
26,6820898,1.873100355822789,0.526547264884884,glen a krahenbuhl attorney
26,6820899,-2.7976403306836684,2.7697174822081307,edward l serr attorney
26,6820900,-2.8343421272425227,2.967201586826699,thad m oviatt attorney
26,6821258,-2.296849009824677,-0.2614615675209304,lisa e battan pc
26,6821259,-2.6023194490824286,-0.22833593382673234,"lisa e. battan, p.c"
26,6821260,-0.5045827048348656,1.9719981714216712,lisa e battan attorney
26,6821281,-2.760378109117944,-0.6472467827969438,andrew spiegel pc
26,6821389,-0.03605636836722162,1.623094075953992,julie kreutzer attorney
26,6821479,-1.2286292058678852,-1.7004342075279268,cameron w tyler & associates
26,6821595,5.13370509388299,0.6164851010790173,michael a ruderman attorney
26,6821757,-3.0378384231887234,0.19919695236025414,howard o bernstein pc
26,6821758,-1.0296789585764208,2.393490676516712,howard o bernstein attorney
26,6821759,-3.2245782169167985,0.29274785142168497,"howard o. bernstein, p.c."
26,6821911,-1.4014049144153748,-4.176961243570698,balis & barrett pc
26,6821913,-1.3663580680710234,-4.242628304123204,john h barrett attorney
26,6821914,-2.96477274030769,1.9996637376687036,barton s balis attorney
26,6822083,-3.7980487964666185,-1.7226214919820426,natalie nelson inc divorce mediation
26,6822553,-1.2328461546717802,1.7411143916970926,steven e harris attorney
26,6822556,2.53667522649594,2.927227628550702,carol glassman attorney
26,6822558,-3.348785454261995,3.2447267839045084,barre m sakol
26,6822590,1.016559435959566,-3.1705126762844533,pat law
26,6823022,-1.1185405252484666,5.041232182089066,berg hill greenleaf rusci
26,6823023,-1.4385607036957295,2.5703653408977853,david g hill attorney
26,6823024,-2.8314385670435853,3.045972771677081,giovanni m ruscitti attorney
26,6823025,-1.8980896114439452,2.991488190188022,susan t richards attorney
26,6823026,-2.5894331114712994,2.941142374194473,kathleen t alt attorney
26,6823027,-1.322813161562937,2.54797722474781,neil c king attorney
26,6823028,-1.9877869663432304,1.7724307496518503,melanie b lewis attorney
26,6823029,-1.292468863454289,2.5670475475240773,heidi c potter attorney
26,6823030,-2.3988462341245467,3.054214149063668,melissa m heidman attorney
26,6823031,-1.9427933369530908,2.511332390064853,judy b snyder attorney
26,6823032,-1.899914210473786,2.6776926074558434,jon n banashek attorney
26,6823033,1.6113253896107742,0.6605785875635257,josh a marks attorney
26,6823034,-1.3965806463376027,2.4938421491327163,justin c berg attorney
26,6823035,-1.8360299946805312,2.874405198340737,jason p pink attorney
26,6823037,-1.4064323435109507,2.638129323545292,richard f greenleaf attorney
26,6823038,-1.0973984001287798,4.99877337407644,berg hill greenleaf & ruscitti llp
26,6823039,1.6191479350868747,1.8992071637614056,asimakis p iatridis attorney
26,6823040,1.7020000978235263,2.2287892598217387,thomas e merrigan attorney
26,6823332,0.2749923051135551,1.4949266230341332,ed byrne attorney
26,6823888,1.5175362447218648,0.6442434770768853,craig a weinberg attorney
26,6824013,2.0288344563220697,0.3968064317966792,"gallagher & gallagher, a"
26,6824021,2.0220068978113206,-3.9033787126324793,agren blando court reporting & video inc
26,6824094,-2.934597470735741,2.3172775563742065,clifford j barnard
26,6824119,1.5101069788207706,0.16451772812483456,saint claire and greschooler
26,6824120,-2.5037622950313505,1.866928904832521,dipak p patel attorney
26,6824121,1.8626512744875916,0.5841951398756551,scott a st clair attorney
26,6824122,1.549814613290087,0.23937430385242495,st clair & greschler
26,6824515,1.17032877072852,2.13043480367782,barry satlow attorney
26,6824527,-4.3862742301859265,-0.3719352689503607,hensley & kennedy
26,6824528,-2.5562094706739944,3.8807045539356686,jeff l foltz attorney
26,6824781,0.6162741583393109,4.996511542789108,jon sirkis attorney
26,6825066,-2.306640713990515,-3.0140141081207448,immigrant legal center-boulder
26,6825208,5.000319219898713,-0.2536985813795157,james a cooke attorney
26,6825305,0.09436168937165254,-0.3859783107854028,march fischmann
26,6825569,0.7232502117521291,0.0563698000952169,hult law firm
26,6825918,-2.9312285309819974,1.92034094195181,"merenstein, gary e atrny law"
26,6826108,-1.9771898871733904,1.0047189290205227,martin & fest
26,6826532,-0.2819773958828414,1.0396280991059823,robert e lanham attorney
26,6826534,-0.3121901470224531,5.09734935403477,"robert e. lanham, p.c."
26,6826546,-2.457507768125316,-2.7692645510650706,alternative law office
26,6826547,1.9217199597121688,3.9816498178548634,marc milavitz attorney
26,6826672,-2.4468803659058533,-0.8436852785277671,rick dyson pc
26,6826739,2.1188282397274865,4.0095433554329505,barbara lavender attorney
26,6827400,0.945983210320126,3.5603534259703564,dan cleveland attorney
26,6827842,2.2387011756456614,2.2856457899569733,keith c pope attorney
26,6827906,3.0030113030705263,0.2219682376125205,taffet law
26,6828207,-1.3779056543911723,2.7349262878290137,david m westbrook attorney
26,6828428,-1.0578216011092854,2.7071491609958893,gregg j friedman attorney
26,6828434,1.0478060378781404,3.7209165196297,gregg greenstein attorney
26,6828435,-2.3302793434062394,1.6943690249939238,oliver e frascona attorney
26,6828437,-3.6111569992960013,2.5173548737863896,joyce m bergmann attorney
26,6828438,1.844379229538816,0.5378072402044053,joseph a cope attorney
26,6828439,-3.0661761831852834,2.4740683653157203,cinthia m manzano attorney
26,6828440,1.8348783134215467,0.5867592788675448,jonathan a goodman attorney
26,6828441,-3.622317002457271,2.4965378186535503,amy f allison attorney
26,6828442,-1.3531886143694047,2.383227340716005,roger g bock attorney
26,6828443,1.8217743602228071,0.6029239736495097,william a robinson attorney
26,6828682,4.990795948610663,0.3050487942931098,patricia linville attorney
26,6828684,5.609145925427463,-0.9229543636716434,joseph b jonikas attorney
26,6828690,-2.4128922782675746,3.0478312613653817,patrick t murphy attorney
26,6828691,-1.9471140113296264,3.1165583088537447,michael j thomson attorney
26,6828692,-1.6593154198244555,3.1568504610853565,william r gray attorney
26,6828696,-1.0539437520491255,5.049299601408436,"purvis - gray, llp"
26,6828714,5.280757615631981,0.4996498070529018,donald t goulart attorney
26,6829375,0.4450636131932968,5.096940022107996,sara bayko attorney
26,6829376,-2.7065128138431898,3.237424503476949,lew m harstead attorney
26,6829549,-2.1338572889538945,-2.5006795306827234,steven louth law offices
26,6829550,0.2140579894086416,-1.728724779136556,the law office of steven louth
26,6829653,0.7649724625380754,-0.15549424685469,studholme law firm pc
26,6831148,0.7568717788505366,-0.13310818962504986,neugeboren law firm pc
26,6831377,-1.562070078377625,-2.4574389434700925,martha buyer law offices pllc
26,6831381,-1.7156946989690314,1.9180179089000384,mary n street attorney
26,6831676,5.620985593330105,-1.7700910183493457,larry d lee attorney
26,6831952,3.395207957342907,-1.1798012553498158,david mastbaum law office
26,6832404,-0.8493592313818407,-1.038729474518472,"hofgard, kurt c law offices of"
26,6832412,5.495805354897231,-0.9950233027138756,michael f browning attorney
26,6832652,-0.07286876779495867,-1.7005313066998202,law offices of keith a shandalow p.c
26,6833681,-1.3268765985623368,-0.12578273953432567,james j keane law offices
26,6834027,1.2679554281980632,3.9387009429093536,bert dempsey attorney
26,6834333,5.3660364738848365,-1.3848699948184209,conard j metcalf attorney
26,6834335,4.1867814190092085,-1.7096659477822047,trine & metcalf
26,6834348,-2.6590817006546885,3.6227269648797655,jeffrey l skovron attorney
26,6834412,0.4579677012063239,3.4224119826909405,judd golden attorney
26,6834496,1.688917338250007,3.984608560353831,john tweedy attorney
26,6834498,-2.8110334133516006,3.446938589486808,meghan l hungate attorney
26,6834640,5.5052956868406655,-0.9465196771611056,jonathan l miller attorney
26,6834655,0.8637693944540347,1.3026283878321303,brandon fields attorney
26,6834665,1.9497160385446524,-2.149581433992343,cederberg law firm
26,6834666,-2.62229005524726,-0.43256119775585744,"cederberg, buchanan & jordan pc"
26,6834669,3.4561995142851143,-1.2580807130044078,casey mulligan law office
26,6834670,5.625862372414005,-1.7525235511100683,"casey j mulligan, attorney"
26,6834751,-0.7320851199429483,1.7404371055408132,charles p martien attorney
26,6834931,-2.674477249509354,-0.6484058058875755,beth klein pc
26,6835115,-0.4739561326781253,-2.6752467654136707,crescendo artists
26,6835177,-1.4330407737249085,-3.633006162370288,"tim wilfong and associates, llc"
26,6835482,0.05648095878125644,2.4380542073649063,tracy gray attorney
26,6835485,-0.9667988713694464,2.8581286901835004,scott h reisch attorney
26,6835707,-0.4143503929680922,-2.9493241175356464,wunsch & co
26,6837110,-2.175044165029685,-2.616839408082128,colson & quinn law offices
26,6837112,1.926228173867597,2.2056385125634264,joyce e colson attorney
26,6837114,-2.3231542893087664,-0.2355663907025985,"lisa e battan, pc"
26,6838512,0.8145763431384133,1.2272117040288244,whiteing & smith
26,6838939,0.00010745389995136497,2.8559067094838686,keith moskowitz attorney
26,6838940,3.358695549997757,-1.3002545578313267,david walder law offices
26,6838987,3.4428074020596995,-1.266520221359157,the law office of paul stuber
26,6839180,-4.210142950502321,-1.892175526950044,collins & rafik
26,6839873,0.7260297731842826,0.031290322481679456,the shuman law firm
26,6840379,-2.657514400900473,3.691620047831576,deborah l taussig attorney
26,6842193,1.1775600847815488,-2.209028082292241,braverman law group llc
26,6842200,-0.10616678877476443,-1.655175532512577,law office of gary c flynn
26,6842201,-0.008328660581944007,-1.6737746001329523,the law offices of eric j moutz llc
26,6842202,0.24838273080862835,-2.2119532335582983,mann & maximon law
26,6844261,1.9192202838175365,-2.1700685104482624,cribari law firm
26,6844262,1.4564621643272486,-2.6644933725952407,cribari law firm p.c
26,6844263,4.981491562127834,0.3100715235467486,david moorehead attorney
26,6844266,0.9596002607659688,-3.190685456810662,richman law firm llc
26,6844566,2.89808188640756,0.15869381903437216,tanttila law
26,6845991,-4.2083663813582035,-1.8443270375547298,moorhead & griffin
26,6849750,2.300768532958531,3.665820355700451,shawn o'buckley attorney
26,6891075,0.9421076170223116,-1.0995617745989443,stephanie k schacht llc attorney at law
26,6968133,-1.3588404201989928,-0.4592835097525764,miller richard a md
26,7009646,-1.0548367606528002,-1.6606593188426302,mark earnhart law office
26,7012656,1.9355595892273751,1.3183645932681585,the harper law firm p c
26,7035129,-0.52187835470582,-2.877744237035498,burns figa & will
26,7035713,-2.578095518966652,-2.93446321942447,leyendecker law offices
26,7036407,-3.137013650755452,-1.5337338287535671,harris karstaedt jamison power
26,7036408,-3.368625889878958,-1.465109713870753,harris karstaedt jamison
26,7036410,-2.697037263687505,-1.7316426655055075,"harris, karstaedt, jamison & powers, pc"
26,7036411,1.6236915111608596,0.6328594873521248,mark a neider attorney
26,7036412,-1.8969859684774537,1.8364194236919171,jamey w jamison attorney
26,7036413,1.8540451037298256,0.5652315229511883,chad a atkins attorney
26,7036414,-0.3545897327149822,1.8686905200572268,thomas h falivene attorney
26,7036417,-1.9940719302249361,-2.015083871673145,harris karstaedt jamison powers pc
26,7037097,-2.0332570090263,1.719017524040636,wesley w hoyt attorney
26,7037268,-4.309852844604069,-2.4212857647624033,moss codilis llp
26,7037703,5.336485127449113,-0.5257191232589146,daniel a sloane attorney
26,7037707,5.0596871042858105,0.8263738946544564,michael nimmo attorney
26,7037708,5.066592637886378,0.8803771308053189,neil hillyard attorney
26,7037781,-0.5109785274154536,-0.42268849384090995,mc conaughy & sarkissian
26,7066387,-2.6100794214823804,0.9750099920363164,thomas j hammond
26,7078619,3.4444420917550063,-2.7870028437500407,patrick miller & kropf pc
26,7080026,-4.717561364414332,-0.5372979479982789,allen wertz & feldman
26,7080027,-4.715772794032856,-0.5197494994307669,allen wertz & feldman
26,7080028,-4.702009021829727,-0.6057712895762863,allen wertz & feldman llp
26,7080146,-1.7038098349877258,-2.2511875344676793,aspen dispute resolution llc
26,7080147,1.6967827258393455,3.9261218496418224,scott harper attorney
26,7080437,0.3392107097493383,1.9808581002212855,maria morrow attorney
26,7080549,1.615837657434425,0.4213807315695179,cheryl a malcolm attorney
26,7080683,4.943180751618334,0.8846842982515628,attorney richard cummins
26,7080709,-0.7850596338091211,4.576948531540858,klein cote & edwards llc
26,7080711,-1.6130169550259137,2.934313709471158,joseph e edwards iii attorney
26,7081390,-0.7491374516318835,-3.1963083013382336,litvak litvak mehrtens
26,7081392,-0.7734944968456505,-3.399530693064218,"litvak, litvak, mehrtens and epstein, p.c."
26,7081393,-0.7507932932062612,-3.1544482730384438,litvak litvak mehrtens
26,7081394,-1.2599082640516204,0.7567171136274374,marie e drake attorney
26,7081408,-0.3671339768179944,1.9691830526516743,jeanne c doremus attorney
26,7081604,5.6000582780226775,-1.1233802673157274,neil d karbank attorney
26,7081664,5.669586896885035,-1.1286644986032963,kerry h wallace attorney
26,7081665,3.4151694592780095,-2.8351963492519947,goodman & wallace pc
26,7082011,-1.618300246931749,2.6316621259074293,clint p van zee attorney
26,7082018,5.570030013095686,-1.783086357190461,martin h freeman attorney
26,7082277,5.6775616329814165,-1.224938849919658,patrick d mc allister attorney
26,7082287,-1.1749325021917294,2.7061146657158464,scott c miller attorney
26,7082288,-1.3345850067260316,2.556841085327767,paul c noto attorney
26,7082289,-2.609793058112342,3.4448932008601294,ramsey l kropf attorney
26,7082290,-1.4272303931067136,2.8092812947853654,craig v corona attorney
26,7083835,0.3516143743950784,3.1394191715190667,rick jones attorney
26,7084391,1.933713515190604,3.9322540647303366,michael feigenbaum attorney
26,7084393,-4.1490740603709035,-1.6789691078910334,brandt feigenbaum
26,7085678,3.4060393969755536,-3.1638354951534904,pitkin county district attorney
26,7086561,-4.404487381097729,2.1486577297382445,mcguane and hogan llp
26,7086562,-4.40733448445108,2.1458529873843553,mcguane and hogan llp
26,7102751,0.4595758535663541,-3.4416949555313887,segal law llc
26,7113898,-2.612069637509041,0.7808021873282271,david s rolfe llc
26,7113899,1.8659130129070716,0.5224392449576666,kathleen a teltsch attorney
26,7121641,-1.5381091863044964,-2.7591845467668983,hulbert law service
26,7121675,5.59629153674463,-1.0068536537803994,peter f waltz attorney
26,7165135,5.197415420700496,0.6529550078880181,john c hugger attorney
26,7166231,-0.2971836760708511,5.126132445616356,kevin j mullin
26,7166564,1.8403750983065783,0.3519201183627911,seth a grob
26,7166565,1.9824102348565416,0.5954414845356023,seth a grob attorney
26,7166629,2.0542188547378033,2.3259893534249345,john h lonnquist attorney
26,7166797,-1.375913253132519,-1.5633578769586087,wheeler law offices pc
26,7166828,5.056051472272788,0.5727428065266202,susan a stearns attorney
26,7166851,-1.226667247765207,2.2756808227056555,raule g nemer attorney
26,7166853,1.4664198036433138,2.438758796642962,john d coaty attorney
26,7166854,-0.677656708884369,-3.1813134463959267,toussaint nemer & coaty
26,7167525,5.480623360723718,-1.0169573091536672,edmund g lambert attorney
26,7167683,-1.2856707553899165,-1.4133360530280084,emily s ossmann law office
26,7167860,-2.6667576373467745,3.5258705461340707,virginia l frank
26,7168040,5.1228974762514765,-0.7375738358069419,paul figlia attorney
26,7168767,1.006003705257815,-3.090911535177875,montgomery law firm llc
26,7169078,-2.7056100298251056,-0.2915594858712137,andrew leifer pc
26,7170587,5.247550919745719,0.6422969056682236,michele r couch attorney
26,7175451,1.5152866648396432,3.9214786757289337,scott evans attorney
26,7212941,-1.5507042818096832,-0.8960697298564128,patrick j martinez
26,7218995,-2.1665276871054133,3.4157161423719686,philip m smith attorney
26,7230855,5.565947993654648,-1.02659347659775,michael j keenan attorney
26,7271833,4.8282059319340185,0.9098534202618821,pllc silverman & borenstein attorney
26,7276044,-1.4494916061130334,-2.311119708545961,sadler real estate inc
26,7347864,-1.2904915780412156,-1.424575707762044,mc cartney law office pc
26,7402807,1.1714916857945146,3.8334079932905314,dirk nelson attorney
26,7438250,-1.3282629278703455,3.5911600890366,michael p zimmerman attorney
26,7438251,-1.0356767373781557,3.648718901763548,michele gage attorney
26,7438253,2.4358625444483484,3.3185881437938063,zimmerman michael attorney
26,7443481,0.022523196756872383,3.52289508028202,schroeder colorado inc
26,7524410,2.032290525538843,2.4702908788118614,albert v evans
26,7524411,2.1192330783540334,3.431092932999823,alan i lipson attorney
26,7564780,-0.463773782224869,-0.9043036685191054,the law offices of ralph a cantafio
26,7565637,-0.0564429087957252,5.17641593559592,sherman p romney attorney
26,7590281,-1.9024261745784277,3.561172578428522,daniel t smith attorney
26,7616523,-0.4475295814800041,4.666591784201693,law office of william b
26,7616651,5.18655112812651,0.6196660550975376,william g kaufman attorney
26,7616671,0.5025561472364404,-3.475593348902671,"hopkins law, llc"
26,7617264,1.2134519415936411,-0.6191935093684896,hammond attorney at law
26,7617430,-2.9137586925508767,-2.378924167830003,riley kathie trou
26,7617786,3.4238088753413662,-1.1004213861545369,law offices of tim rees
26,7617956,2.5775801006242767,3.2432725457905045,matt busch attorney
26,7618478,4.991211201542582,0.32780860121990424,cathleen a mc ewen attorney
26,7618521,2.468379793055162,2.2980225727898667,dina m christiansen attorney
26,7618522,-0.5032841613930168,2.839823117845279,dwight d brummet attorney
26,7619653,3.442261089208849,-1.2710865779389875,the law offices of michael c.i bonafede
26,7620070,5.2755265123086525,0.5414699108110197,mark r shaffer attorney
26,7620435,1.4675116387360432,2.4632432162426032,dianne h peterson attorney
26,7620447,1.5589082111732382,-2.156517338564126,vanmeveren law group
26,7620873,1.4058995631188804,-2.113472966603928,balzer law firm pc
26,7623453,0.1353092565867239,-1.7688161817470185,law office of chris d hefty
26,7624022,1.9876281994150968,0.5777283998021039,gregory a white attorney
26,7671007,-1.5736131938649285,1.7626805953187077,wade ash woods hill & farley
26,7671008,-3.009398892880029,2.7993742617489743,josie m faix attorney
26,7671011,-3.0949059136994426,2.8295676303916166,spencer j crona attorney
26,7750225,-1.4375650521262258,-3.130264252789829,hamilton faatz waller pc a professional corp
26,7750492,-1.658825775178953,2.270463923488177,john g lewis attorney
26,7750496,2.3727052877352794,1.3469821130137698,dino a ross attorney
26,7750497,1.4739601821164885,2.5424129004623284,russell w kemp attorney
26,7751607,-0.016982774695207908,5.189874371504813,matt c o'brien attorney
26,7751608,0.02051613920087565,5.183399361965924,richard b rose attorney
26,7751612,-4.217040959663296,0.11348214258530948,sawaya & rose p.c
26,7751613,-1.1884057451122438,0.08977232040743609,sawaya rose kaplan & mcclure
26,7751647,3.200336235493095,0.2722935004229043,semler law
26,7752922,-0.370717122317096,2.10611445976454,douglas d koktavy attorney
26,7753171,1.8758922106451408,0.5613339484952127,bruce a kugler attorney
26,7753174,1.3478838030936644,2.466321330602007,lewis d hansen attorney
26,7753253,-0.4423841373204586,-2.746128111253584,jaudon & avery
26,7753472,5.545925279043771,-0.9914679016786978,andrew d peterson attorney
26,7753473,5.562025096147702,-0.9772623913722779,donald l cook attorney
26,7753474,5.628004441548606,-0.8952009894338311,mark r davis attorney
26,7753475,5.476096645080379,-0.9271627238233006,michel p williams attorney
26,7753478,5.645368331403266,-0.9579308974193821,michael f ludwig attorney
26,7753519,-1.2281489399712084,1.5821514687782945,mark e harris attorney
26,7753520,-1.8741069910293235,2.4160460622085944,paul e collins attorney
26,7753688,-0.5041463452394691,-3.021270117248618,vaughan & de muro
26,7753769,-0.8443467934309655,5.018860333311177,"semple, miller & mooney pc"
26,7753918,-1.890421097618597,1.6275878573925948,roseanne landau attorney
26,7754232,-0.5010268066606139,1.8354927678721635,allyson c hodges attorney
26,7754233,-3.647614249905885,-1.42647652998004,nathan bremer dumm & myers
26,7754381,-1.5708928422867492,-3.224613509988098,rumler tarbox lyden law corp pc
26,7754382,-2.9112176864755535,2.635744016669725,cyndi l lyden attorney
26,7754383,-2.251041141400434,3.1554902319330123,scott m tarbox attorney
26,7754384,-1.6516998791071171,-3.2559605812246133,"rumler, tarbox, lyden law"
26,7754385,-0.4999475156424108,2.6252897741036554,matthew j casebolt attorney
26,7755158,-1.6919888441689181,-4.586183887562007,joseph h thibodeau pc
26,7755159,-1.6865674901915368,-4.592262906739577,joseph h thibodeau law office
26,7755160,-1.6902299069433624,-4.578016495410584,"joseph h. thibodeau, pc"
26,7755161,-1.6959773535493576,-4.616765969917833,joseph h thibodeau attorney
26,7755240,5.081711731536928,-1.1728594523835698,m david johnson attorney
26,7755487,-0.6419766360562207,-0.9490731825100386,law ofcs of richard dehnc
26,7755867,-0.5773179611262311,4.655686420980566,mitchel s drantch law offices
26,7756035,1.1733563435062058,-2.284712312891397,the orr law firm llc
26,7756038,1.1597436925414404,-2.4298250386649136,orr law firm llc
26,7756294,-2.405717377006489,2.7226282385067013,kirstin l smith attorney
26,7756488,4.469313490171508,0.1047153491185685,"markofsky, daniel b attorney at law pc"
26,7756801,5.251596918640602,-1.6204039809726904,susan m schaecher attorney
26,7756802,3.223564620843163,-2.9845796309250074,stettner miller pc
26,7756991,2.367443464763562,3.241301910175679,richard johnston attorney
26,7757196,-2.511746894596488,3.4466601246746915,john m dingess attorney
26,7757496,-3.1819766332925585,-1.1941703347682542,wolf slatkin & madison
26,7757605,0.8209069411679397,-0.8504629770668686,"stokes, allen w jr, atty at law"
26,7757936,1.6522998046188784,2.5101341347497,richard l angell attorney
26,7757990,-0.6155234892637688,2.0998653194588104,paul g goss attorney
26,7758110,0.3607907643124074,3.0577703382213635,gerald dahl attorney
26,7758111,-4.1642807827514865,-1.8996985786561535,"murray dahl kuechenmeister & renaud, llp"
26,7758344,2.4249647404790693,2.9293946518653144,michael gilbert attorney
26,7758563,-2.2036721933786967,-1.2976362204672158,"fairfield and woods, pc"
26,7758564,-0.762581530226114,2.3591869393212233,craig d joyce attorney
26,7758566,-2.565423499414652,2.353432956412373,marcie l cassell attorney
26,7758958,1.3339480671814634,-2.0007921128028965,the ott law firm pc
26,7759379,-2.881274978015812,2.40448535609827,gary j ceriani attorney
26,7759383,-1.7201495172759946,-0.7902423713749518,michael h steinberg
26,7759666,5.331690319588027,0.4833599922648104,david r fine attorney
26,7759965,-0.4985001900024679,-2.56640539095015,centurions limited
26,7760024,-2.173845831941561,3.16008963893164,daniel m fowler attorney
26,7760026,-2.6443433826975893,2.7702964237741368,timothy j flanagan attorney
26,7760363,5.069821516412903,0.4692554697703665,richard greengard attorney
26,7761030,-4.028676400467304,-1.2721114505090407,"senter, goldfarb & rice, llc"
26,7761031,-1.3822711416404103,2.104790604111494,john d hayes attorney
26,7761032,-4.104469509968757,-1.237868263674586,"llc senter, goldfarb & rice attorneyey"
26,7761034,-4.095815459656223,-1.2528487629810678,"senter, goldfarb & rice, llc"
26,7761037,-0.5409409622709498,-0.3276634874132092,llc senter goldfarb & rice attorney
26,7761092,-2.2078845423943045,-0.2204397058764776,j randolph robida pc
26,7761170,-1.5309487193147409,2.7108884866495453,john s evangelisti attorney
26,7761177,0.3207525514106009,-1.6770726946633971,"lowe, fell & skogg llc"
26,7761336,-2.401983739679822,2.8117051560789323,kerry l sullivan attorney
26,7761337,-1.2335162964642534,0.6085476874173837,peter h mc guire attorney
26,7761570,2.756695731690675,2.8732410830874286,dworkin chambers & williams
26,7762973,-0.7361640538648975,2.3072881490376123,jon d sawyer attorney
26,7763139,0.6320636094279785,3.4896734348086493,benjamin sachs attorney
26,7763141,-1.2352536545570676,2.329636524591029,erin c genullis attorney
