cluster_id,item_id,x,y,item_name
26,4778458,2.5399561253639007,2.4153802341432984,bruce lampert attorney
26,4779572,-0.3884372068081778,-0.7968172638190091,the law office of john w tinder ii
26,4779573,1.2233406702469194,2.1953155041695984,john w tinder attorney
26,4779574,-0.3925464881074277,-0.730941724096394,law office of john w tinder ii
26,4779575,3.328850373349144,-1.4687677135627857,remington law office llc
26,4779576,3.782272741507264,-2.048707767169452,thornton bankruptcy attorney company
26,4779577,-1.0620553169489273,-0.17330251746243247,john b dougherty pc
26,4779752,-0.8494391846132266,-1.2299026229421726,law office of brandon marinoff
26,4782604,-3.526011127966936,0.7998799214053628,brett w martin pc
26,4782605,-3.5936670719044614,0.8476038777311939,"brett w. martin, p.c"
26,4809492,-1.1511431401739476,-0.4586105130334138,office of law
26,4970412,5.556286649550133,-1.096810543576957,jane s mitchell attorney
26,4988625,-3.8086222780778267,-0.4819331951479497,edward levy p.c
26,4991479,-2.308886144178036,-0.8736940734558909,rosenthal associates pc
26,5026435,1.4065437888749621,-2.2800066443453684,the firm mahoney law
26,5041201,2.2850947454584176,2.2783050990782874,robert e ray attorney
26,5043322,1.4985460036935965,3.9485366887758797,david martinez attorney
26,5060621,0.20061254827502334,5.0760670823343625,scott a brairton attorney
26,5060622,-0.07836155496470049,5.143523905666843,robert m pomeroy jr attorney
26,5060623,-0.039295869873566536,5.1790589678567835,thomas j todd attorney
26,5079204,1.010659187337853,-3.1907976501883177,"davidovich, nathan law firm llc"
26,5120897,0.9896043524698492,-0.7618790845510922,"white, joseph attorney at law"
26,5128653,-2.080500555068199,2.957084589225337,elizabeth h getches attorney
26,5128654,-1.2925186112863238,3.0212955003265547,erik k foster attorney
26,5128655,1.4764100898524657,3.9790658348915047,john benitez attorney
26,5128656,2.4293728923773714,-0.9242111964833568,jennifer gokenbach attorney
26,5128657,-2.203306229116005,2.581570914230445,marilyn w mc williams attorney
26,5128659,1.014665493262051,2.25686132863568,james t burghardt attorney
26,5157489,-1.5782998653899252,0.6734530929689709,wendy j harring
26,5157490,-0.051595264457370095,0.03557938792381528,"norman b. beecher, p.c."
26,5164491,-1.6008144643719933,4.379380512201679,"dufford & brown, pc"
26,5164492,-1.1214168339001953,4.0004456261007695,adam b kehril attorney
26,5164493,-1.148884954519752,4.011765112085364,christian b hammond attorney
26,5164495,-1.1769686972295277,4.003483170327797,john r heronimus attorney
26,5164496,-1.17000339147112,4.009416350338069,jack f ross attorney
26,5164497,-1.1572787941112042,4.022016708832534,thomas g brown attorney
26,5164498,-2.906935981669804,4.340822211323922,"dufford & brown, p.c."
26,5164500,-1.1307797220531235,4.05802184732715,stone lawrence d
26,5169155,2.352339120922628,1.2300024341762972,john a love
26,5174793,-1.1130268593636774,-1.2077203602289557,sharon k black law offices
26,5206980,0.8410374046378242,3.601291169036181,nathan davis attorney
26,5211652,-2.5655421610691875,0.8525273891600423,"theodore p watson and associates, llc"
26,5211653,-2.613575230786157,0.6369704424374459,theordore p watson & associates llc
26,5211654,-3.4609070454205173,-1.6401281469361726,theodore watson & associates llc
26,5330168,0.4485361826648391,-2.264195250918917,dewhirst and dolven llc
26,5352947,-1.3014495779332838,-0.1636879070229974,james j keil law office
26,5355469,3.39158007302758,-1.1981513327777178,elliott law offices
26,5467887,-2.268805919380954,-3.74062361702832,lim
26,5480144,-3.0454640583697903,2.842677731340955,lindley j brenza attorney
26,5485368,-2.345016570183045,-4.084014852274757,"greene, meyer & mcelroy"
26,5485369,-2.3390894640375444,-4.08221418204694,mc elroy meyer walker & condon
26,5521650,2.3377719382333755,3.1724643017255767,robert i cohen attorney
26,5522438,1.8818594525150405,-2.2792244420376737,tenebaum law firm
26,5573863,0.3423968592421968,3.188239418857949,michael goodman esq
26,5583850,-1.340261987265312,2.8317235837258345,robert c roth attorney
26,5583851,-1.8061397303864228,2.984753711969076,scott h beck attorney
26,5583852,-1.3782126616971455,2.61562093311754,william c gorham attorney
26,5583853,1.4539869917218586,2.508815404659499,robert j ahrenholz attorney
26,5583854,1.5216977088456825,2.4785434995687674,john h bernstein attorney
26,5594399,-2.8727731595643733,2.434569693711341,gary t potter attorney
26,5598176,0.06499246009760838,-1.232888860561989,"montgomery, william robert law offices of"
26,5665207,-0.3525866876356312,5.0737087115098385,scott w doyle
26,5671547,5.4658288120451965,-0.8117697480627636,john g scott attorney
26,5673824,-1.406721784977801,2.657005755358187,michael c dawson attorney
26,5673825,-2.5594313765368155,2.9922646884821202,jill t norris attorney
26,5674237,-2.293111602900072,3.1832327761847226,robert m o'hayre attorney
26,5715771,2.046430099740726,-3.948787424914588,computer court reporters
26,5716925,1.1849636523307272,-2.524424721859918,"the tipton law firm, p.c."
26,5756284,-1.1833835507416932,2.7376629956079164,jeffrey r becker attorney
26,5772650,3.5228468049661434,0.1324347187313438,reveles law firm
26,5772676,-1.3743415507908032,-1.6774895295703318,les downs law office
26,5773003,5.273640964370903,-1.835814630828677,dennis m malone attorney
26,5773008,1.8265751933847336,0.5191651586060998,george a newnam attorney
26,5773009,-1.5813038030315276,2.245537943703151,mary d newnam attorney
26,5773010,0.8520586334257781,-2.0039855484484157,newnam - land llp
26,5773011,0.8328116539330249,-1.926630081935245,newnam land llp
26,5773014,5.4748233609479975,-1.018049583937967,glenn v davis attorney
26,5825612,1.3282194346506766,0.16093480439957206,james a caufield
26,5865352,-2.4287008251619993,2.1815848616552347,"sullivan, sullivan & mcguire attorneys pc"
26,5883132,-0.8587122106684029,4.9610708316067385,benson & case llp
26,5883133,1.6666874295213503,3.9832580666224504,john case attorney
26,5883134,-0.8449959166440613,4.956706028838426,"benson & case, llp"
26,5883136,2.2273691750084645,2.540689912811809,aaron l evans attorney
26,5899983,0.7822891092673787,3.4417884402670342,dan cross attorney
26,5901544,-4.336778601220281,-2.005730204617076,roger moore esq
26,5907365,3.2299396795740543,-2.8383394744893327,tueller & associates pc
26,5908376,0.25392461121483256,-0.6648373236171635,"masters, william s llc"
26,5909565,2.535030859036181,1.4868555443452842,pc robinson waters & o'dorisio attorney
26,5910628,5.414632235499479,-0.42675416786618303,rebekah newman white attorney
26,5910630,5.339828693584313,0.4156331774959968,susanne j ross attorney
26,5910631,-0.01709944011659791,5.107310079579212,robert l balkind attorney
26,5911570,-0.2694573415058529,1.7080811038070165,james c forslund attorney
26,5962406,-0.03833444171555762,-1.6500187760054017,law offices of irvin borenstein
26,5962407,-2.2515537259560063,-2.5806740234609897,irvin borenstein law office
26,5978304,1.7325360418650868,3.855239306633289,carl wright attorney
26,5993911,1.1282307346019451,-0.4710270140166434,"smith, curtis v attorney at law"
26,5993912,-1.1144148481365692,2.6000582861074126,stephen c cook attorney
26,5993913,0.7717590581131618,-0.3991289991969311,"smith, curtis v attorneyey at law"
26,5993914,-2.290236722236856,0.4862473615412541,smith & cook llc
26,6011982,1.9815752837482168,-2.189331344862278,gonzales law firm
26,6021105,1.2312623188526068,3.844678131291973,gregg anderson attorney
26,6025215,-2.05637845407043,3.2869259032054883,greg l perczak attorney
26,6041824,-3.657908560990542,0.3717096545904385,"minor & brown, pc"
26,6041826,-3.776382312122777,0.5196570986201241,minor & brown
26,6061610,-2.4522196821695585,-1.6404512990564908,bierbaum law offices
26,6063768,-0.903462880269461,1.232382472064704,"goddard, jo anna"
26,6116502,1.3650830662778943,4.066198791955572,joan clifford attorney
26,6121474,-2.511937106471232,3.346436176019047,cynthia l bargell attorney
26,6125426,2.2987591850135907,2.0430070834583582,p c d scott robinson attorney
26,6127530,-0.17211113700349642,0.5546581735197725,milestone counseling inc
26,6137961,-1.9817040993299964,0.214709194334896,gilbert frank ollanik & komyatte pc
26,6137963,1.944066264068358,0.5182224433837763,stuart a ollanik attorney
26,6148435,1.1323316954198552,-3.334563943773464,mccallum law firm llc
26,6151920,3.769626165561432,-2.1224543020768176,budget divorce colorado
26,6163923,-0.8148625169638133,-1.1156733818274778,mc callum real estate-invstmnt
26,6163928,-1.9572335609631648,2.1607916792788897,theodore p demos attorney
26,6172541,-0.9721795238314276,2.5718900542958174,ronald d rome attorney
26,6179579,1.201057369637108,-0.4373997690271387,"stuart, martin attorney at law"
26,6182752,0.9133380789631244,-2.89558055409988,the burnham law firm p llc
26,6193549,0.3845469073544072,2.87057909540514,john j rossi attorney
26,6220065,-2.277648051189667,-2.1105112920548392,martens & associates pc
26,6292136,-0.007833184626153929,5.182286528380242,bradley c rupert attorney
26,6298875,-0.6809866459381074,2.1894368333444385,mark s cohen attorney
26,6343646,5.170270699807073,-0.5370616748762421,john burke attorney
26,6367503,-4.651686072371102,2.1718670260099344,thornton city attorney
26,6377507,1.820571375139289,1.8272426188748885,jeanne y jagow attorney
26,6378377,-0.4698500708873682,0.05278527092097296,law firm of joseph c cohen pc
26,6378853,-1.7572732504835875,-3.9176200267138057,hubert t morrow & associates
26,6380638,-4.354642051522681,-2.1723575419729384,heckenbach carlton ammarell llp
26,6381767,4.7956123213400526,-1.4126003966391985,martin d brown pllc
26,6381768,5.058501519405686,-1.2254014768755273,martin d brown attorney
26,6382380,-1.7539692259236814,-3.9290993670974963,bernard h greenberg & associates
26,6383246,3.5801641933096566,-1.222166540780806,miller and stiart law offices
26,6383527,-0.7721718682396581,-0.3148161432006988,mark j taylor pc
26,6384893,-2.3027123816635533,-1.757989740924332,dennis brovarone pc
26,6384916,3.4436892923269684,-2.829558716154254,barbara quade pc
26,6385468,-1.6018897186619268,-3.781371019877725,"k. a. marchman & associates, inc."
26,6386086,-2.744089980375763,-0.4188537025571529,"miller & steiert, pc"
26,6386087,1.7126852376145738,3.962253053829322,andrew congtiguglia attorney
26,6386089,2.3751038354936047,2.1365899146394063,benjamin e currier attorney
26,6386091,-0.6817193444882428,0.1445531389281459,bell & pollock p c ( inc)
26,6386149,5.5332882352148935,-0.6358430738842004,theodore radkiewicz attorney inc
26,6386180,-1.8116618466423369,2.7839694411230766,"ney, peter h attorney at law p c"
26,6386836,5.552663857078206,-1.0020342143961645,john m prentiss jr attorney
26,6387164,-2.8999640526103305,-0.32615069301167665,anderson & jahde pc
26,6387165,-3.9786349449474496,-0.3570875937963031,"anderson & jahde, p.c"
26,6387312,-2.437290487702278,0.3839381163678386,ham & ortiz llc
26,6388364,1.1930364182732245,-2.9477401990165166,hamilton law firm p.c.
26,6389332,0.9141229184676054,2.3874634849668186,law q llc
26,6389334,0.8949645559571742,2.3904620139521167,law q
26,6389755,2.078190749453245,-1.5147882969240285,thomas a meyers
26,6390235,1.143135753347875,-2.9899691468731584,pummell law firm llc
26,6391672,-2.388939468635248,-2.6102212395071605,lam law offices
26,6393180,5.459069792094616,-1.0066745176892682,david c little attorney
26,6393181,4.455976381955196,-0.9555886325521308,christopher little attorney
26,6393182,4.477688279152477,-0.8095719721267552,christopher taravella attorney
26,6393183,5.061959270651318,-0.9750967735312716,debra piazza attorney
26,6393184,5.500529391262658,-1.0749552174077528,courtney j cline attorney
26,6393185,5.672690034029643,-1.114707521014124,michael r mc cormick attorney
26,6393186,5.631197515667791,-0.8805982618826982,robert r montgomery attorney
26,6393187,5.637996573900458,-0.9776135509530592,robert j beattie attorney
26,6393188,5.692613774929259,-1.0813606088666483,william j seafoorce jr attorney
26,6393189,5.530389662743604,-1.048239056047734,william h knapp attorney
26,6393190,5.811076337200612,-1.218122866091179,bayard j young attorney
26,6393627,5.396713970821866,-0.8204521018745439,david j stevens attorney
26,6394121,0.9368728141225771,2.5463330675462683,christopher felton attorney
26,6394543,-2.6500184171565557,0.3728231826333668,harmon s graves pc
26,6394600,-0.7845015235784308,-0.4327226013389701,hill law office p c
26,6395274,5.4846655709972465,-1.0264567094015358,jeffrey w ludwig attorney
26,6395515,-1.409370107461615,2.6040127464819114,jean c arnold attorney
26,6395517,1.1784894643858101,-0.6696771849586323,"arnold & arnold, attorneys at law llp"
26,6395585,-1.1595255448014752,-0.6857556037399439,law officies eric l nesbitt pc
26,6395615,5.009030853240113,-0.20389081850907176,kathy a higby attorney
26,6395638,-2.6683306464016803,2.133340494894956,glenn w hagen attorney
26,6395879,-1.0314439571477454,-1.3415883360201442,law office of david owen
26,6395880,-1.8433338362056424,-1.9165328594052635,jolein a harro pc
26,6395881,-2.0032448611192297,-1.8688687622053217,jolein harro pc
26,6396222,-1.3586789092786646,2.236642611824022,peter b albani attorney
26,6396236,5.624138110710398,-0.930835705982154,craig f chambers attorney
26,6396666,-2.5434541449264976,0.2620170356901081,patrick m plank pc
26,6398430,-2.620813776850777,0.574304050621688,wms homes llc
26,6398435,-2.4507703138674923,-2.666257374061772,rumi engineer law offices
26,6398728,1.7122490587904582,0.01970741486369261,sue a jones attorney
26,6398729,1.5102898367416957,-0.4505975624696423,jones sue a attorney at law
26,6398820,-4.120188005146344,-1.63631024116871,swanson & bratschon
26,6400405,-4.352436493258288,-1.9186491022921104,"atkinson | boyle, pllc"
26,6405405,5.205984600810441,0.14480271139517212,joseph antolinez attorney
26,6407660,0.7650078671445392,0.4515486451502443,divorce lawyer near littleton colorado dlfl
26,6408592,3.5378401787989833,-1.5877846510302336,bankruptcy attorney in littleton local area services
26,6408593,0.8065393324723977,-3.0782149109127284,the reha law firm llc
26,6408596,0.7812042357594887,-1.5720576141133094,law firm of ronald s dee
26,6408597,0.7601197969395378,-1.6561454554757291,ron dee law
26,6408599,-1.8303242601082328,-2.270479951437077,kathryn ann lincoln law offices
26,6408603,3.4642844173086482,-1.052314433092542,law office of barbara a duff llc
26,6409849,3.413654670125497,-1.0822251966987086,law office of charlene stratton
26,6409850,2.002660525243988,1.6380369667886578,law offices of brandon r ceglian p c
26,6414603,1.9468379258311492,3.9996083531006383,mike hulen attorney
26,6421442,-0.4609770671620748,4.7434646041160775,terrance a noyes llc
26,6421522,-3.821008911605935,-2.365830351725217,ve morgan llp
26,6424886,-0.32448239632926906,-0.09438409125213053,llc sulee rabin attorney
26,6425338,-3.013757580258676,2.925451809369524,kathleen t bond
26,6483714,-1.0266195830165126,5.06627303322199,moye white llp
26,6483715,1.8767149527658789,0.534060462021232,carrie a rodgers attorney
26,6489843,-0.034278298583679895,5.223454238430736,dale j coplan attorney
26,6489844,-0.1276068770842064,5.199555870795268,kerry n jardine attorney
26,6489845,-0.0664243404881211,5.176857521537514,thomas w henderson attorney
26,6489851,-0.09030917521926027,5.17638614699959,holly s baer attorney
26,6489852,-0.010648718749613649,5.17650752793398,david k te selle attorney
26,6489853,0.521862355960335,5.030184411025687,scott eldredge attorney
26,6489854,0.013561927525321059,5.173193251168078,david p hersh attorney
26,6494433,0.7070759337186214,-0.7185204829305281,barber legal
26,6495583,5.058586636469699,-2.118953054174133,"pryce, douglas r attorney at law"
26,6495697,1.4311594781817845,3.8115962856228554,samuel livingston
26,6495698,1.6221420440890648,3.8437334729911257,samuel livingston attorney
26,6496231,-0.11286898001431896,1.156233001141305,catherine hansen-stamp attorney
26,6498428,-0.8813721637747144,-3.1656602956649125,jr and associates llc
26,6501701,-1.9154952218486023,-2.8667481634059038,"bradley, devitt and arp pc"
26,6501702,-1.9548706545936436,-2.9298549062125576,bradley devitt & arp pc
26,6502132,-4.331807981915523,-0.7117502798721417,"james spaulding powell, llc"
26,6503327,-2.8767551334614403,2.6874975695960455,j p schmitz attorney
26,6503419,-0.0022670766355810017,3.411667148437425,owen minerals llc
26,6503936,0.6973778935716338,-0.018679841458625668,wallace beattie law firm llc
26,6504099,0.2944368892235347,4.624012329938993,walsh law
26,6504378,-1.9736979576244598,-2.0115177799142168,bradley devitt & haas pc
26,6504380,-1.3478729741291542,2.919548678620474,andrew d haas attorney
26,6504381,-3.175137445112157,2.6522268665957904,jerald j devitt attorney
26,6504382,-1.4967028322329163,2.873454295190568,steve w watkins attorney
26,6508066,2.2414603917151426,3.8987096905219625,linda rediger attorney
26,6508067,5.727947764862722,0.08145453418849251,lori moseley attorney
26,6508248,4.953315704153036,0.9116096089090934,peter keppler attorney
26,6508414,1.5534269484355008,3.9293250994774698,lynn jordan attorney
26,6508820,-0.43334537169031095,-0.8870821674128784,the law office of lauren kelly p c
26,6567815,3.6712131510907935,-2.21040736921094,"mitchel, paul & co, pc"
26,6567817,3.5904225836042207,-1.488079796245228,law offices of paul mitchell llc
26,6567818,3.472919320399092,-1.4478029268840895,paul mitchell law office
26,6567819,3.477589206372412,-1.4731265009651275,"law offices paul mitchell, llc"
26,6568309,-0.08871805175099451,2.4956155041073065,mark cohen attorney
26,6582155,-0.8657498478180402,-0.4793963670718235,c j archer law offices
26,6605275,1.6288542937504191,-2.766553980757387,firm masters law
26,6605276,1.2584061993397022,-2.784360019555304,masters law firm llc
26,6605277,1.6074357857557109,-2.746151233153141,masters law firm
26,6605278,1.5367475659882222,-2.7790705617249354,the masters law firm llc
26,6606328,0.8632512837411482,-1.4211143923470904,della s nelson attorney
26,6606428,2.118261899586232,-1.5177500676252984,metamorphosis counseling
26,6606731,0.02072690319775039,-0.8211665782472425,irrevocable trust of adam
26,6607518,2.0063561804107017,-3.978933608835352,rusk reporting
26,6608426,-2.91117251579449,2.486159113346112,laird t milburn attorney
26,6608594,5.048716677938777,0.8592279213687629,brian kidnay attorney
26,6622502,3.5524884636580283,0.07813123483819077,zink law firm
26,6645006,-1.7685633974244732,3.5077114191251195,paul h stevens
26,6645007,-1.781699022143565,3.129499833853121,paul h stevens attorney
26,6653813,-1.6144936339666562,3.248481983996223,scott h robinson attorney
26,6657047,-1.9240656813364958,-0.9141168139816648,mc allister law office
26,6657048,-1.908733448962644,-0.966787628101096,mcallister law office pc
26,6712043,0.987100591602214,-1.788096033382056,"hannon, kevin s law firm llc"
26,6712044,0.5602265237707725,-2.193565613139153,for the environment
26,6712046,0.9455561841952445,-1.6882673636002608,"us environmental colorado, llc"
26,6719973,-0.627384031707159,4.666563181693151,henry c frey llc
26,6719974,-0.8830768276953651,4.322175971008751,frey henry c llc
26,6719975,1.948251807025959,2.4060834531530357,henry c frey attorney
26,6725498,-1.1872175016344908,-1.6869037593168807,enten law center
26,6731719,0.15066336803786487,3.4003472192306035,robert justin driscoll attorney llc
26,6733239,4.013247457347141,-1.924215059997904,rifle city prosecutor
26,6733931,-0.536967769868212,4.728720905674602,greg s russi law office
26,6734439,5.098944870337919,0.5781829355008444,daryl k james attorney
26,6735096,1.7904641091767939,2.2717374689766348,thomas d silverman attorney
26,6751044,-1.246512829761856,1.389173432467739,patrick c mcginniss
26,6765378,3.9496528775424826,-1.914786183632744,lark fogel
26,6775733,1.1475057336967278,-0.4984849886881168,taylor and rapp attorney at law llp
26,6775734,-4.171234087494257,-1.9510904170295744,taylor & rapp llp
26,6775735,3.2246807118996355,0.7227303531641351,jerry manzer attorney
26,6776323,5.087823354331358,0.6229401290867167,michael a lazar attorney
26,6777351,-3.39550166526378,-1.498382949039298,houtchens houtchens & greenfield llc
26,6777353,-2.3496697214059403,4.248221530271397,brandon b houtchens attorney
26,6777354,-3.460569147484404,-1.5486913131288744,houtchens houtchens greenfield
26,6777355,-2.3830900241987814,4.214171683604999,sean j lacefield attorney
26,6777356,-2.340377140559025,4.247369689696127,john b houtchens attorney
26,6778619,-0.10340639574517964,5.102095512285165,paul w sacco attorney
26,6779095,1.407604376512568,-1.9351834809013453,gavaldon law pc
26,6779120,3.540449375573067,-0.046175096801186366,the trevino law firm llc
26,6779210,2.0522013587231034,-4.0301092474084035,rjm med trans inc
26,6779352,-0.19793552382555035,4.837893224187624,mark a rapp
26,6779689,2.0587316632025248,-3.883761111358153,"agren blando court reporting & video, inc."
26,6780476,5.6889553667874075,-1.3684438790881843,bradley d laue attorney
26,6780477,5.539172318285165,-0.7276590298309991,thomas e hellerich attorney
26,6780478,5.622207353803465,-0.5366534755268537,william w hughes attorney
26,6780479,5.259003929241246,-0.31333495892208946,julie scroggis attorney
26,6780480,3.6836466176470886,-1.9773782158590512,winters hellerich-hughes llc
26,6780483,5.210367260468144,0.5986768635037371,john s zakhem attorney
26,6781005,1.071770208643565,-3.0654968008322205,trevino law firm
26,6781763,-1.4184529328138966,-2.059247337536141,mc adams law office llc
26,6782256,-2.1544783698485754,-0.9989719525100312,grant hoffman & kamada pc
26,6782257,2.366124354328564,3.461200011413012,ryan kamada attorney
26,6783305,-2.600781618357691,-1.2698188640798125,noelle padilla law office
26,6785478,1.2028356258148507,-1.109015471565715,keith coleman attorney at law llc
26,6785480,2.000678254126005,3.9320023837607234,christoper collins attorney
26,6785481,-4.168801914319155,-1.942863179232384,collins liu & lyons llp
26,6786468,5.072242715019167,0.5890343544854987,gladys l sexton attorney
26,6786471,0.9053003367303312,-3.082391651953332,stout law firm llc
26,6786521,5.193225979659338,0.6636600587889131,zane m pic attorney
26,6786522,3.379436181924852,-1.287720767540557,joseph bodine law offices
26,6793548,0.6047143652632,0.0692052163685063,weber law firm llc
26,6812833,-2.7116156541151666,1.290583358629264,stone & rosen
26,6812882,0.00968665009996262,-1.856009709831232,law office of nancy w salomone
26,6813068,-1.7059501554847678,2.7042169564142817,stuart b corbridge attorney
26,6813069,-0.3875817308702133,-2.657442848358612,vranesh & raisch
26,6813070,-2.864839937170208,2.4504770226092805,eugene j riordan attorney
26,6813083,0.2987313210825592,-4.265420164509498,"greenlee, winner and sullivan, p.c."
26,6813084,0.2848319610648526,-4.359372642285206,greenlee winner & sullivan
26,6813085,-3.0583684063463408,3.06836762736582,donna m ferber attorney
26,6813086,0.3379103527226567,-4.187294838039272,"greenlee, winner and sullivan, p.c."
26,6813311,2.103603518162714,3.4048167103128852,leonard i frieling attorney
26,6813325,1.6252623340259345,3.927912694361935,evan freirich attorney
26,6813467,-1.170423337697117,1.9781314180350316,lenore b fox attorney
26,6813567,-3.5123417634996867,0.20672904839168696,"moses, wittemyer, harrison & woodruff pc"
26,6813569,-2.0062230341091256,3.0094730557450013,richard j mehren attorney
26,6813570,-1.9210363419525367,3.5609133987764072,david l harrison attorney
26,6813571,-3.0489692845417604,2.729497110484448,timothy j beaton attorney
26,6813727,3.3849709139175768,-2.90397308493268,cooley zagar-brown pc
26,6813797,-2.8187887648462264,2.6813146827981185,stephanie l brennan attorney
26,6813799,1.142600539559991,2.702555924834714,christopher blakemore attorney
26,6813801,-0.4397127615229322,2.640533840834852,harold w flowers jr attorney
26,6813802,1.0559463749725433,0.9468790317957368,thomas a swett attorney
26,6814073,-2.310639579966858,2.9860685602181456,scott j mc comas attorney
26,6814114,-0.6254675313608314,2.4597312504488107,shelly d merritt attorney
26,6814631,-1.152813156876503,1.4312994727346786,randolph p nicholson attorney
26,6814633,-0.2616262106378277,2.382582699981357,gerald c sloat attorney
26,6814671,5.332420141754759,-1.501904466311192,dennis j tharp attorney
26,6816101,-2.3086100300430505,1.7403811578300707,renee e ezer attorney
26,6816103,-3.0962480813313262,2.811729765503806,carmen s danielson attorney
26,6816139,-1.2992349054406769,2.978904316415543,steven j foster attorney
26,6816140,-1.551735441829509,2.0057504743518564,mark j sather attorney
26,6816141,1.6542941395790205,3.2409762957291015,kingsbery johnson & love
26,6816142,-2.192498815231135,2.434074119548989,walter w kingsbery attorney
26,6816274,1.4296020620571528,0.1649397619353566,"coates, christine a attorney at law"
26,6816455,-0.7764502217994268,-0.6716715882591285,brynn grey partners ltd
26,6816463,-1.1068288911133195,2.564065964721857,john g steinkamp attorney
26,6816472,-2.214595468890026,1.8529800010586728,sharon e caulfield attorney
26,6816473,-2.1725780018495584,1.79492927198492,meghan e pound attorney
26,6816474,-0.2710573612528941,1.7590912922009925,james c branum attorney
26,6816475,1.8593882781939264,0.5375419636413815,jennifer a sullivan attorney
26,6816476,-2.0036654343255718,1.9055418108554856,richard e bump attorney
26,6816477,1.84792422637582,0.5433821270909172,william a ahlstrand attorney
26,6816479,1.5049205340972096,2.4565158404581884,kristin c edgar attorney
26,6816569,-1.0496447295201865,1.400310813092454,noel c lindenmuth attorney
26,6816571,-2.253302381493604,-0.15422420950380558,larry d. lee pc
26,6816572,-0.6733322412938669,5.05210239208788,larry d lee
26,6817082,-2.166536882070897,1.8763025603603047,maureen e eldredge attorney
26,6817083,-2.0885664485284514,2.9480377395231963,melissa j sullivan attorney
26,6817084,-1.9195273235022656,0.5631808707961027,hutchinson black & cook
